{
  "$schema": "https://json-schema.org/draft/2020-12/schema",
  "title": "HME compact causal coherence proof",
  "type": "object",
  "additionalProperties": false,
  "required": [
    "schema",
    "intent",
    "artifacts_touched",
    "causal_path_ids",
    "verifier_ids",
    "proof_artifacts",
    "forbidden_paths_checked",
    "open_risks"
  ],
  "properties": {
    "schema": { "const": 1 },
    "intent": { "type": "string", "minLength": 1 },
    "artifacts_touched": { "type": "array", "items": { "type": "string", "minLength": 1 }, "minItems": 1, "uniqueItems": true },
    "causal_path_ids": { "type": "array", "items": { "type": "string", "minLength": 1 }, "minItems": 1, "uniqueItems": true },
    "verifier_ids": { "type": "array", "items": { "type": "string", "minLength": 1 }, "minItems": 1, "uniqueItems": true },
    "proof_artifacts": {
      "type": "array",
      "minItems": 1,
      "items": {
        "type": "object",
        "additionalProperties": false,
        "required": ["path", "kind"],
        "properties": {
          "path": { "type": "string", "minLength": 1 },
          "kind": { "enum": ["test-output", "invariant-output", "runtime-output", "trace", "metric", "fixture"] },
          "sha256": { "type": "string", "pattern": "^[0-9a-f]{64}$" }
        }
      }
    },
    "forbidden_paths_checked": { "type": "array", "items": { "type": "string", "minLength": 1 }, "minItems": 1, "uniqueItems": true },
    "open_risks": { "type": "array", "items": { "type": "string" } }
  }
}
